{
  "$schema": "./schema.json",
  "$id": "https://raw.githubusercontent.com/NateScarlet/auto-dragalia/master/src/locale/zh.json",
  "banner": "${name}: 版本=${version}, 资产=${asset}, 语言=${locale}",
  "idle-text": "停止",
  "repeat-raid": "重复战斗",
  "feed-dragon": "自动喂龙",
  "feed-four-leaf-clover": "喂四叶草",
  "farm-rare-item": "刷稀有",
  "present-button-not-found": "未找到礼物按钮, 请手动前往龙之庭院",
  "no-present-available": "无可用礼物",
  "transform-to-dragon": "龙化",
  "use-dragon-skill": "使用龙技能",
  "no-support-skill-available": "支援技能不可用",
  "use-support-skill": "使用支援技能: ${pos}",
  "image-not-found": "未找到图像: ${id}",
  "image-found": "找到图像: ${id}: ${pos}",
  "wait-timeout": "等待超时",
  "wait-image-appear": "等待图像出现: ${id}",
  "wait-image-disappear": "等待图像消失: ${id}",
  "run-task": "运行任务: ${task}",
  "team-too-weak": "队伍战力不足, 无法通关",
  "closeness-reach-lv29": "信赖度已达到29级，若继续，请手动喂食",
  "no-clover": "没有四叶草，请去炼草",
  "entering-stage-1": "检测到正在进入第一关卡",
  "entered-stage-1": "检测到已进入第一关卡",
  "entering-stage-2": "检测到正在进入第二关卡",
  "require-level-select-page": "请至关卡选择页面再开始",
  "rare-item-dropped": "成功刷到稀有物品, 继续完成战斗",
  "no-rare-item-drop": "没有刷到稀有物品, 直接下一轮"
}
